id	tweet	subtask_a
6392	Τα φιδια γιατί δεν τα κυνηγούσαν για τη φωτογράφιση; #GNTMgr	NOT
5884	@USER Παιδί μου δε γνωρίζει ο άνθρωπος αυτός τι σημαίνει πόνος φτώχεια και δυσκολίες. Αυτός κι οι όμοιοί του νομίζουν ότι γυναίκες όπως τη φωτο λερώνουν τον όμορφο κόσμο τους. Είναι πνευματικά ανεπαρκής κι επικίνδυνος αν ασχοληθεί με τη πολιτική. Καλά έκανες και αντέδρασες.	NOT
398	@USER Είσαι και χοντρή!	OFF
3150	@USER Διορισμοί στη δικαιοσύνη, κάψιμο χαρτιών που δεν βολεύουν, κανένα ρουσφετάκι...	NOT
1881	#shoppingstar Γωγώ Παρουσιάστρια Έγινε	NOT
4268	@USER ξέρεις άντρες είμαστε ε έχουμε και δικαιώματα δε θα μας έχετε κλειδωμένους στο πλυσταριό και όποτε σας γκαβλωσει να μας ρίχνετε και κανα μουνι κάπου ώπα με τη μητριαρχία	OFF
3878	@USER βγάλτο απο την πρίζα 10 λεπτά βάλτο. μια πλυση χωρίς ρουχα στους 90 με σοδα και χλωρινη.τελειώνει βγαζεις μπριζα .ανοίγεις φίλτρο βαλε μεσα ενα δάκτυλο (ασχολίαστο)γύρισε την αντλία και εισαι κομπλε	NOT
4946	ΜΩΡΗ ΜΑΛΑΣΤΟΥΠΕΣ ΤΙ ΚΑΝΕΤΕ ΤΑ ΝΕΑΚΙΑ ΣΑΣ	OFF
7820	Μεγάλη γυναίκα είναι. Μήπως έπαθε κάτι και πήρε μόνη της άλλο δρόμο και τώρα είναι στ αζήτητα τώρα; #fosstotounel	NOT
7576	αφου το κοριτσι δεν το χει γιατι να ειναι εκει μεσα; ας μπει καποια αλλη στη θεση της επιτελους #gntmgr	NOT
103	@USER Οι ασπροι κακολογουσαν τους μαυρους επειδη δεν τους κερασαν τιποτα ενω αυτοθ θα το εκαναν, οι μαυροι ελεγαν οτι η Αφροδιτη δεν παραδεχεται ποτε οτι καποιος αλλος ειναι καλυτερος απο αυτην. Λιγο πολυ αυτα που λενε καθε μερα. (Σε ξεχωριστα πηγαδακια βεβαια).	NOT
321	Το τραγούδι «Πάλι στην ξεφτίλα» που έγραψε κ τραγούδησε ο Άσιμος ταιριάζει απόλυτα στις μερες που ζούμε! «Πάλι στην ξεφτίλα Κι είχες μια σκασίλα Αποδοχή χωρίς υποταγή Γι' αυτό δεν κλαίω ούτε γελώ Μα από τον κόσμο ασφυκτιώ Λέω να φτιάξουμε παράνομο σταθμό Να διαδώσουμε σ' αυτούς	NOT
6861	Η Σουζανα σημερα #GNTMgr	NOT
7241	Καλός μακακας είσαι κι εσύ Στέλιο και εσύ και ο καθένας πίσω από την εκπομπή του Λιαγκα ...ένας δεν είχε μυαλό και λιγη τσίπα να σας μαζέψει ...#kalomesimeraki #mesimeri_skai	OFF
3670	@USER Θυμάμαι πως βοήθησαν όλοι οι ξένοι στην Μίκρα Ασία όταν σφάζανε τους δικούς μας βλέπανε τις φλόγες από τα καράβια στα 5 μίλια μην ξεχνιόμαστε	NOT
5406	Η καημενη η φραγκοκοτα που επεσε στα χερια της Κατιας #gntmgr	NOT
6881	Να αποκλειστεί, δεν έπιασε φραγκόκοτα. #GNTMgr	NOT
9625	Τι sweet November μωρε πουτανες που εχει βραχει και η κωλοτρυπιδα μας 11:23	OFF
2469	@USER Τι ηλθια εισαι κοπελα μου; πραγματικα απορω.	OFF
3945	#shoppingstar τι στο διάολο είναι το Μιντιλόγλι και το Ψαροφάι; εξωγήινοι πολιτισμοί;	NOT
628	@USER ούτε μια τρίχα απ'τα @@@@ τους δεν είσαι ,γυρολόγε που πήγες με όλα τα κόμματα	OFF
9709	Ποιο είναι το κοινό σημείο που έχουν όλοι οι θρασύδειλοι, λεχρίτες, πούροι αριστεροί, βουλευτές που δεν σέβονται ούτε ανθρώπους ούτε θεσμούς; Το χρήμα! Είναι η πλούσιοι από κούνια η Δημόσιοι Υπάλληλοι. Εξαιρέσις ουδεμία! #NOVARTIS_GATE #Novartis	NOT
10131	Με το ζόρι να γίνει μοντέλο. ΔΕ ΜΠΟΡΕΙ ΛΕΜΕ #gntmgr	NOT
1673	@USER ΕΠΙΣΗΣ ΠΑΣΧΕΙ ΑΠΟ ΤΟ ΣΥΝΔΡΟΜΟ ΤΗΣ ΣΤΟΚΧΟΛΜΗΣ ΕΠΙ 40 ΣΥΝΕΧΗ ΧΡΟΝΙΑ ΝΑ ΨΗΦΙΖΕΙ #ΝΔ_ξεφτιλες ΚΑΙ ΠΑΣΟΚ (ΚΙΝΑΛ).	NOT
7023	Κατια οσο και να προσπαθησεις δε με πειθεις οτι εχεις αισθηματα με τα δηθεν δακρια σου .... ενα κουφαρι εισαι χωρις αισθηματα γι αυτο ασε τα ψοφια σου #gntmgr	OFF
10282	@USER μηπως δεν εχετε καταλαβει ακομα οτι με 1000000 προσφυγες και λαθρομεταναστες,με Μοριες,Ειδομενες,OLAF,δεν δικαιουστε να μιλατε για #μεταναστευτικο ;	OFF
5651	@USER Θα το λέμε συνέχεια. Ποιο φασισταρια από την αριστερά, δεν υπάρχουν πουθενά.	OFF
3062	@USER εισαι επωνυμος λαρισαιος αφου	NOT
8943	Η Κευση σχολιάζει. Το Twitter: #GNTMgr	NOT
4065	@USER φοβάμαι όμως η καριόλα	OFF
9850	Γελάτε εσείς με την υπεραλίευση αλλά σεβαστείτε λίγο και την Κάτια μας που χάνει το μισό της τσουχτροσόι κάθε χρόνο #gntmgr	NOT
6560	Τα φίδια όταν αποκαλύπτονται ψάχνουν πάντα τρύπες για να μπουν #GntmGr	NOT
2577	#GynaikaXwrisOnoma έτσι που κάθεται η τουμασατου στους καναπέδες θλιμμένη μου θυμίζει τη Ρεγγίνα στη βέρα όταν ήταν έγκυος που όλο ήταν έτσι να σκέφτεται το Στρατο	NOT
1745	Σε επίπεδο ρεπορτάζ, η παραμονή Βαρέλα είναι από τις ωραίες ιστορίες. Τα είχε όλα. Εγωισμοί, παρεξηγήσεις, σπασμένα τηλέφωνα, μούτρα, παιδιά, γυναίκες, ατζέντηδες, προτάσεις, σκάιπ, συναντήσεις, πολύ μπλαμπλα.	NOT
1157	@USER Ενώ εσύ που κατάλαβες τι σου είπα κάνεις το κορόιδο κ ρίχνεις τη μπάλα στην εξέδρα. Δε σου κανω τη χάρη όμως...θα σε ρωτάω συνέχεια μέχρι να απαντήσεις: Είσαι οκ με το 5.4; Είσαι οκ που μόλις 3.7 των νέων στήριξαν ΚΚΕ; Είναι επιτυχημένη η δουλειά που κάνει το κόμμα; Φταίτε κάπου;	NOT
5035	"""Η πόζα της Κάτιας δεν είναι """"κατάλογος"""" του '90; #gntmgr"""	NOT
6937	Η Έλενα μπροστά στις τσοκαριες αυτές φαίνεται τουλαχιστον κοκο Σανέλ #gntmgr	OFF
10250	@USER Screen shot μαλακες χάνω τα καλύτερα	NOT
8515	"""""""Μια γυναίκα ερωτεύεται τα χέρια σου, γιατί από αυτά καταλαβαίνει αν ξέρεις πώς να προστατεύεις, να χαϊδεύεις, να στηρίζεις, να κρατάς.. να κατέχεις."""" ;Alessandro D' Avenia #Pensamientos #Sentimientos #Soñadores #Destino #Vida #Passion #Momentos #Magia #Camino #Caricias #Tocar"""	NOT
3699	Ουτε τα δειτε αποψε δε θελω να βλεπω πια απ το #masterchefgr . Τους σιχαθηκα! #ShoppingStar	NOT
649	Δεν μας εφτανε το πολιτικο σκηνικο εχουμε κ τα ηλίθια με τα θέατρο που παίζουν είναι κ ατάλαντoi! #poweroflovegr	NOT
3402	Εξ αιτίας αυτής της σιχαμένης,έχω αντιπαθήσει κ τους κριτές!Όλοι ένοχοι γι αυτό το καραγκιοζιλίκι! #MasterChefGR_Xeftiles	OFF
3088	Τι έγινε @USER ; Μας πέρασε ο Μουτσινάς στα νούμερα και φέρατε το βαρύ πυροβολικό (Γωγώ); #shoppingstar	NOT
9790	@USER Μωρή το γύρο της πόλης έκανα. Που αλλού να πάω; Στη Νικαια;	NOT
9548	Τώρα που κερδάμε #GNTMgr	NOT
8200	Ντροπή στην ομάδα των μαθητών στα Γιαννιτσά	NOT
9985	#gntmgr #gntm πήγε το σκατό στον κώλο της Κάτιας και ξεκίνησε το γλυψιμο	OFF
8077	Ποιοτικό επισόδιο μυρίζει σήμερα και νιώθω παρακατιανός #gntmgr	NOT
4670	ΚΩΛΟΔΑΧΤΥΛΟ ΜΕ ΒΕΡΑ ΠΟΝΑΕΙ #ερχεται_ΠΟΥΤΣΑ #ερχεται_ΚΑΡΑΠΟΥΤΣΑ ομως	NOT
5279	@USER φυσικα! φωτογραφηση Μυκονο και με κοτες! καρφωνει η Μαρινα οτι η Κατια κανει μπουλινγκ στην Ελευθερια! #gntmgr	NOT
3702	10 σκάνδαλα των Ζαίων που δεν έχουν διερευνηθεί. Ο Κυρανάκης τον έκανε ξεφτίλα τον Αρβανίτη, ξεκάθαρα, αλλά εάν δεν τους βάλουν φυλακή, όλα αυτά θα είναι μόνο για τα μάτια του κόσμου.	NOT
8476	ΝΟΕΜΒΡΗΣ ΜΠΗΚΕ αλλα εμεις αποψε παμε ταξιδακι με στο #GNTMgr σ ενα νησι! Ποιο αλλο;	NOT
9243	Γιαυτο μωρη πουτανα Nova μονο σπασμενη σε βλεπω!	OFF
9756	Άλλη Ξανθη από εδωωω #gntmgr	NOT
3977	Αφροδίτη για μένα προσωπικά είσαι η πιο λάθος εκτίμηση που έκανα στο φετινό #survivorgr #Survivor2019	NOT
7307	"""Εν τω μεταξύ η υπεραλίευση δεν έχει να κάνει με το """"τι περνάνε τα καημένα τα πλασματακια"""" αλλά με την καταστροφή των υδατινων οικοσυστηματων λόγω της υπερβολικής μείωσης του πληθυσμού τους... (ένιωσα την ανάγκη να το διευκρινησω, Τζιζους Κραιστ δηλαδή...) #GNTMgr"""	NOT
9576	Υπήρχε αυτή η μικρή κατηφορική κλίση! Σκοτώστε με τώρα! #gntmgr2 #gntmgr #GNTM #GNTMgr	NOT
10219	Πάντως το μόνο που αξίζει από όλο το επεισόδιο, είναι το τελος που τις κρίνουν. Όλο το υπόλοιπο δε βλέπεται #gntmgr	NOT
3019	συν 1 εκατομμυριο φολοερς πηρε το κοριτσι σε 10 ωρες, αλλα αντικειμενικα αυτος ο κωλος το αξιζε.	OFF
6165	#gntmgr ολες αυτες εχουν γκομενο αυτο	NOT
8389	Παλι κλαιει το βλαμμενο #GNTMgr	NOT
4475	Κοιταξτε ρε που βγηκε θυμα η Μαρθα. Η ΜΑΡΘΑ #gynaikaxwrisonoma	NOT
9605	μόνο εγώ θέλω να χτυπήσω την οθόνη κάθε φορά που μιλάει η ασημινα #gntm #gntm2 #gntmgr	NOT
10118	Να έχει και η γυναίκα δικαιώματα. Σε όλα τα πράγματα όχι όμως ίσα. Άγνωστος Έλληνας 2000	OFF
6997	Πωπω ρε μαλακες ημαρτον	OFF
3613	@USER Πράγματι έχει γίνει χαμός και όλα αυτά περνάνε στα ψιλά,είσαι ο μόνος που γράφει βασικά..	NOT
2681	"""Δολια τηλεόραση τι τραβας... όλοι οι αμορφωτοι και οι αγραμματοι σε σενα ηρθα για """"δουλειά""""... βλεπε Γωγουλινι.. #shoppingstar"""	OFF
8682	Πάλι καλά που η Κάτια θα προστάτευε όλα τα θύματα bullying μέσα στο σπίτι #GNTMgr	OFF
7425	Και το #tatouaz θα μπορουσε να ειχε σωθει ετσι,αλλα το Twitter δεν το ακουτε παρα μονο σε μονοψηφια τηλεθεαση. Βασικα με τον #ναφυγειοΓεωργιου ποτε δεν ξερεις. #erwtasmeta	NOT
3903	@USER Πάλι καλά ! Και να σκεφτείς πάνω από 50% του πληθυσμού είναι γυναίκες !	NOT
4396	@USER ATM εισαι σημερα!	NOT
2538	Είσαι αίμα μου λέει η Αθηνά και γυαλισε το μάτι του του Παύλου #Hepistrofi	NOT
253	"""Ανοιχτά η Φώφη στηρίζει Πατουλη. Η ξεφτίλα στο μεγαλύτερο σημείο..""""Γαλαζωπή"""" ουδετερότητα του ΚΙΝ.ΑΛΛ. σε Αθήνα - Αττική μέσω του χρήστη @USER"""	OFF
5156	Σαρώνει περήφανα η θεματολογία σε σήριαλ, εκπομπές, θέατρο για τους πρόσφυγες που κάποτε έφτασαν από μακριά κι άλλαξαν την δομή τουτης της χώρας, ενώ ταυτόχρονα εντείνεται η άρνηση και το κράξιμο για τους πρόσφυγες που έρχονται από μακριά μη και αλλάξουν την δομή τουτης της χώρας	NOT
7072	"""Μπορείς να το πεις κ εκπληκτικό ντοκιμαντέρ με θέμα """"φιλίες μεταξύ γυναικών"""".. #gntmgr"""	NOT
725	το μηνυμα ερχεται η αληθεια φτανει απο τη ζημια κερδος δεν βγαινει #shoppingstar #αν_το_σεξ_ηταν_αθλημα #poweroflovegr #giatinparea #Novartis 29 Ιουλιου Τουρκια νατο Τραμπ Μαιο	NOT
6522	Ο Ρουβας πολυ χαρούμενος με τον Ρόκκο. #TheVoiceGR	NOT
1012	προφανως ο συριζας εχει παρα πολλους θειτσους σαν αυτους που γνωρισαμε κ που οχι μονο κοροιδευουν γυναικες κ τις βιαζουν, αλλα κ πολλα αλλα ομορφα κ μακαβρια.	OFF
7723	Τί μας κρύβουν; #XFactorGR	NOT
5766	Κάθε φορά που μιλάει η Άννα θέλω να κουτουλησω την τηλεόραση #gntmgr	NOT
7180	Πήγε να πάρει μεζεδάκι ο Μουζου ο γραφικός. Αν ήταν κάνας μαντράχαλος θα του μίλαγε στο πληθυντικό... #TheVoiceGR	NOT
5546	τον κομη δρακουλα τον παλουκωτο χαχαχαχ οχι τον γυναικωτο ρε ΜαριαΑννουλιω χαχαχαχχα #gntmgr	NOT
5713	"""Ποιά είπε """"πες τα""""; #gntmgr"""	NOT
7633	Γυναίκες και Ρέντινγκ από τον Αντώνη Λιάσκο!	NOT
7478	"""Εν τω μεταξύ σε άλλες δοκιμασίες λυσσάει η Καγιά """"Δεν είναι η δουλειά σας να σκέφτεστε, είναι να είστε μοντέλα"""" κ σήμερα εκθειάζουν την Κωνσταντίνα για τις σκέψεις της #GNTMgr"""	NOT
5323	Φοβούμαστε να διαφωνήσουμε με τον #κυρανακης μην μας πουν κομμουνιστές.	NOT
3174	Μας κουνάει το δάχτυλο η Δούρου γαμώ το Χριστό σας μαλακες.	OFF
1869	Σε πέτυχα στο εκλογικό, Φορούσες το κολάν σου, Με χάζεψε η κορμάρα σου, Το ξέρω...στ απ'αυτά σου! Δε θα ψηφίσω τίποτα, για διαμαρτυρία, Θα περιμένω όταν βγείς κι ας είσαι σνομπαρία	OFF
5861	@USER Απ όλα έχουμε κι εμείς, και οι περισσότεροι τρων τα πάντα. Πολλές φορές μάλιστα μοιραστήκαμε φαγητό. Αλλά αυτό, με τη μαλάκο με τη μαντηλα με σόκαρε. Τελικά οι γυναικες είναι οι πιο κολλημένες. Τη γουστάρουν τη μπούρκα. Δεν εξηγείτε αλλιώς.	OFF
424	@USER Είσαι χυδαίος! Δικά μας είναι, ένα ελάχιστο από τα κλεμμένα...σα δε ντρέπεσαι πληρωμένο ζαιοτρολ. Στους γονείς σου και τους παππούδες σου να τα πεις αυτά καθίκι!	OFF
5	ΚΑΤΙΑ ΠΑΡΕ ΘΕΣΗ ΣΕ ΑΥΤΟ ΠΟΥ ΚΑΝΕΙ Η ΛΙΛΙΑΝ Τ-Ω-Ρ-Α! #gynaikaxwrisonoma	NOT
7831	Φορέστε κι άλλο χρώμα παπουτσάκι βρε κορίτσια, δηλαδή αρκετά με το άσπρο blancο της δεκαετίας '80. #gntmgr	NOT
1734	Εντάξει το τερματίσαμε στα πολιτικά, εφ' όσον ο Θεοδωράκης συνέκρινε την πρόθεση ψήφου με τα σπερματοζωάρια. #giatinparea	NOT
6478	Δεν έγινα ξινός μέσα σε μια νύχτα, χρειάστηκαν πάνω από 30 χρόνια προδοσίας από οικογένεια και φίλους και άλλα τόσα συνεργασία με μαλάκες για να έχω τέτοιο καλό αποτέλεσμα	NOT
2985	@USER Φίλε μου δε σε ξέρω αλλά είσαι και εσύ ένα ςκανονικος άνθρωπος όπως όλοι μας. Οι επιλογές σου είναι αυστηρά προσωπική σου υπόθεση όπως και του καθενός μας. Να ξέρεις ότι ο κανονικός είσαι εσύ και όχι όλοι αυτοί που δείχνουν κωλος και πουτσες για να διατυμπανίζουν ότι είναι gay.	OFF
1354	Καλε αυτές θα πιαστούν τρεσα με τρεσα #ShoppingStar	NOT
3982	Όσο αν τρέμω στην ιδέα των λιμασμένων της #ΝΔ_ξεφτιλες π τρέχουν τα σάλια τους να ξαναπιάσουν την κουτάλα, παρηγοριέμαι με την βεβαιότητα ότι αυτή θα είναι η τελευταία τους. Σε λίγο καιρό η ΝΔ θα πάρει την θέση της δίπλα στο ΠΑΣΟΚ τα ποσοστά του. Μακάρι να μείνει κάτι όρθιο	NOT
7215	Έλα ρε βγήκαν όλοι οι Ελλάνιοι με τα ΙΧ για να μην βραχεί το ποπουδάκι τους; Αχου μωρέ τους μαλάκες μου	OFF
4112	Να σηκώνεσαι με κέφια το πρωί, γιατί έχεις την πολυτέλεια να έχεις προβλήματα ή προκλήσεις προς επίλυση. Ρίξε κι ένα χαμόγελο καθώς φτιάχνεις τον καφέ σου, γιατί αντί να χαροπαλεύεις σε κάποιο νοσοκομείο, είσαι στο σπίτι σου!	NOT
4486	Που να βρει τα guts να βγει να σε αντιμετωπίσει #ΝΔ_ξεφτιλες	NOT
2905	#έρχεται #ΝΔ_ξεφτιλες Αναμένω την άνθιση της μεσαίας τάξης !	NOT
7863	Τουλάχιστον στη Χαρά έκαναν σωστό χτένισμα και ντύσιμο #GNTMgr	NOT
9714	Free the nipple η Ασημίνα σήμερα... όλοι την κοιτάνε στα μάτια #gntmgr	NOT
936	Ε βέβαια , Χριστίνα ! Τελείωσε τώρα η δουλειά σου με τον Ορφέα και τώρα τον δίνεις στεγνά ! Σίχαμα ! #tatouaz	OFF
3256	"""@USER Το βλέπεις από λάθος οπτική. Το """"δεν είστε ότι να ναι εξουσία"""" τι σημαίνει; ότι περιμένετε και σεις να ωριμασουν οι συνθήκες για να φέρετε τον σοσιαλισμό; και μέχρι να ωριμάσουν ας γαμιεται το σύμπαν, εμείς καναπεδατη καταγγελία; τι ακριβώς εξουσία θέλατε; λαϊκή;"""	OFF
4365	@USER Εισαι γελοια λεμε. Γελοια όμως.	OFF
6571	Μ' αρέσει που η Ζενεβιεβ φοράει ακουστικά αλλά συνεννοείται με νοήματα με τους άλλους #gntmgr	NOT
1557	Με βάση το @USER αν είσαι πολύ αδύνατος δεν έχεις το δικαίωμα να μιλάς για body shaming! Θα σας σοκάρω εκει στο πάνελ με αυτό που θα σας πω αλλα δεν είναι λιγότερο ρατσιστικό να πεις σε κάποιον «Είσαι πολύ αδύνατος βάλε κανα κιλό»	NOT
6096	Απολύτως κατανοητή η αντίδραση κατοίκων των Γιαννιτσών μπρος στον κίνδυνο να ομορφύνει λίγο μια από τις πιο άσχημες πόλεις της Ελλάδος από πρόσφυγες που προέρχονται από την Συρία, χώρα γεμάτη πόλεις με βαρβαρικά ονόματα όπως Λαοδικεία (Λατάκια) ή Βέροια (το Χαλέπι) #proudlyidiots	NOT
6135	Δεν ξερω Ποιος είναι αυτός που θα τραγουδήσει Μουζουράκη αλλά ωραίος Τύπος φαίνεται #XFactorGR	NOT
5958	Στο επόμενο λέω να τις ντύσουν κλόουν και να τις στείλουν σε παιδικά πάρτυ. #gntmgr	NOT
9251	Δεν έχω πάρει τίποτα από dust and cream, λέω να ξεκινήσω με ασφάλεια με κάποιο βερνίκι νυχιών #gntmgr	NOT
6753	Δηλαδή πάλι την γλιτώνει ο Πάτρικ Ογκουνσοτο; έλεος #gntmgr	NOT
7092	Εμένα πάλι η Μαρτίνα μου θυμίζει τον Jar Jar.. #GNTMgr	NOT
1621	@USER Γκολφω, ψωμολυσα, ποια ψαλλιδα κλεινει ;Αφου νικατε Γκολφω! Τρελλαθηκες απο την πεινα και εισαι ηττοπαθης;	NOT
8773	Η απολυτη δουλικοτητα του πανελ στο Λιαγκα! ενας δεν βρεθηκε να δει το θεμα πιο σοβαρα! τρολαρε-γελουσε το πρωτο βιολι σιγονταριζαν οι αλλοι! ακομα και ο παραθυρακιαςπου ηξερε τη σοβαροτητα της υποθεσης χασκογελουσε! #mesimeri_skai	NOT
999	Ο παλιος μου συμμαθητης απο το σχολείο παντρεύεται. Ε ρε να πάω στον γάμο και να είναι και οι άλλοι οι μαλακες εκεί.	OFF
9034	Μα τι κομμάτι κι αυτό... Ακου πως γίνεται να μην σε αγαπάει τα Σαββατα... Και μαζί να είστε καλε ειδικά το Σάββατο έξω παίζει το ματάκι της.. #TheVoiceGR	NOT
7567	Κάθε μείναν οι φφ τελευταίες όλες; Ποιος φούρνος γκρεμίστηκε; #GNTMgr	NOT
7650	μαρτίνα άντε τον πούλον τον τόσον #GNTMgr	OFF
1654	@USER Ασχετο ότι να ναι, δε με ενδιαφέρει γιατί πρώτον δεν σε ξέρω, δεύτερον δεν έχω ιδέα εσύ τι πιστεύεις και ψηφίζεις, και τρίτον είσαι απλά ένα ενοχλητικό ακάου στο τουιτερ, ψιλοτρελαμένη που έρχεσαι κάθε τόσο να λες μαλακιες	OFF
8152	@USER Μια φορά μαλάκες, για πάντα μαλάκες	OFF
8363	@USER ο πολιτισμός μας είναι ανώτερος ούτως η άλλος γιατί δεν επιβάλουμε μπουρκές στις γυναίκες και δεν λιθοβολούμε.	NOT
1674	Για μένα πιο χάλια απ όλες η Λορέιν ! #shoppingstar	NOT
4241	Και το Μπογδάνο υποψήφιος με την #ΝΔ_ξεφτιλες . Ε βέβαια, τώρα με 10 μονάδες διαφορά δεν χρειάζεται να κρυβόμαστε ποιοι είμαστε...	NOT
8862	Μπράτη κάνε λίγο σεξ έλεος #gntmgr	OFF
9012	Οσο μουνα και να εισαι,οσο ωραια και να ποζαρεις ,μ αυτες τις περουκες εισαι απλα αστεία. #gntmgr	OFF
7836	Πώς να μην της πέσει η πίεση; Έτσι αφάγωτες που τις έχουν για ώρες #gntmgr	NOT
