id	tweet	subtask_a
4376	"""@USER Ποια μη μείωση ρε καραγκιόζη; Ξεχάσαμε νομίζεις την """"παραίτηση"""" του Τσακαλώτου εάν θα μειωνόταν έστω κ ένα ευρώ το αφορολόγητο; ..κ το φτάσατε στον πάτο. Και έρχεσαι κ μας μιλάς για κοινωνική πολιτική. Τράβα γαμήσου το λοιπόν ρετάλι. ..που έχεις και θράσος να κουνάς το δάχτυλο."""	OFF
6017	Αυτό τώρα είναι καινούργιο που μας ρωτάτε οτι αρχιδιά σας κατέβει στο κεφάλι;	OFF
3127	«Power of Lονe 2». Τι να κάνει και ο Ίωνας ο κερατάς; Προωθεί.... #survivorgr #poweroflovegr #shoppingstar #gntmgr #εκλογες2019 #ekloges2019 #ευρωεκλογές2019 #masterchefgr #gynaikaxwrisonoma #petatifriteza #elastithesimou #tatouaz	NOT
4483	@USER Κόψαμε; Για πες μου ρε μεγάλε από ποιον κόψαμε συντάξεις δείξε μου ένα απόκομμα συνταξιούχου του 14 και του ιδίου το 18 αλλά το σανό τον καταπίνεις αμάσητο τέτοιο γίδι είσαι	NOT
6168	@USER Μωρη στραβη	OFF
5444	#GNTMgr ο μαγος παρακαλω πολυ να κανει ενα μαγικο κ να εξαφανισει τον εαυτο του δια παντος	OFF
1551	@USER Εισαι κουκλαρα	NOT
2669	@USER Χαρούμενο σε βλέπω άρα δεν είσαι Καραμανλικός	NOT
3376	Ειδήσεις με Σία στον #Σκαι... σα να τις βλέπεις μέσα απ´το γραφείο - σαλόνι του Κούλη! #Σκαι_ξεφτιλες #εμμονή #survivorGR	NOT
2495	Απίστευτα καυτό, αθώο και ονειρεμένο μωρό, τον παίρνει στο μουνάκι, με το βύσμα να προπονεί την πίσω τρυπούλα του και μετά γαμιέται από το κωλαράκι του, χύνοντας με πάθος και ασταμάτητα!	OFF
2257	@USER Είσαι ελεος	NOT
4274	Η σπυριδουλα παντως είναι μέσα στο κέφι ούτε το άγχος του τελικού την πιάνει ούτε τίποτα άμα είσαι βύσμα τελικά όλα καλά πάνε #masterchefgr_Xeftiles #masterchefgr	OFF
2574	@USER Ευχαριστώ Βίκυ μου, να είσαι καλά κορίτσι μου	NOT
7316	Όχι ρε φυσικά και είστε ευγενικές. Τι; επειδή τις λέτε ζώον, θα τις γαμήσουμε και δεν ξέρω και εγώ τι άλλο; αν είναι δυνατόν #gntmgr	OFF
3973	@USER Εχεις δικιο. Συμφωνώ. Αλλα αμα θες να είσαι ομάδα Φ4, οπως δηλώνεις, πρέπει καποια στιγμή να ανοιξεις το πορτοφολάκι σου κ να πληρώσεις κ τον Χιγκινς της ΤΣΣΚΑ.	NOT
5079	Αυτο ειναι ακομα ενα σιγουρο #KaloMesimeraki	NOT
2011	Οσο κι αν μπορείς να είσαι λογικός Πάντα θα υπάρχει ένα παραμύθι Που θα καταλήξει να πιστεύεις...	NOT
9759	Άντε Ζενεβιεβ σε βλέπω στην επόμενη διαφήμιση για πατατάκια #gntmgr	NOT
7040	ρε πατε καλα; βγαλατε στον τακο αυτες τις 2 φωναρες και περασε ο Λιακ; ΕΛΕΟΣ ΡΕΕΕΕΕΕΕΕΕΕΕΕΕΕ #xfactorgr	NOT
3777	Η πρωτη ερωτηση που κανει στις πωλητριες το Γωγουλινι: Μ ακολουθεις στο ινστα; #shoppingstar	NOT
1665	Αχ Φώτη μου ωραία της τα λες της κυρά κατιας.. Θα της κάνεις το ωραιότερο δώρο.. Δύο γονείς! #gynaikaxwrisonoma	NOT
8149	@USER Πονηρες γυναίκες που νομίζετε ότι έχουμε εκεί το μυαλό μας συνεχώς	NOT
7220	Γαμω το μουνι της μανούλας σου ρε Θωμά... #AgriesMelisses	OFF
3518	@USER Όταν φώναξαν το όνομα σου πως ένιωσες; Ότι είσαι σε κανονικό ευρωπαικό κράτος;	NOT
8236	Όχι κυρία Καγιά,λάθος. Όλοι ξέρουμε ότι δεν θα σώσουμε τον κόσμο. Αλλά πρέπει να παλεύουμε κάθε μέρα για να τον σώσουμε! #gntmgr #gntm	NOT
8641	#kalomesimeraki #agapimeneμουνίko Μου έχουν πρήξει με τη φακλάνα τη Τούνη	OFF
1948	#shoppingstar Οτι τωρα η πωλητρια καταλαβε..οτι θελει ΠΛΑΤΦΟΡΜΑ......ετσι που το είπε..!	NOT
1493	@USER Ο αριστερός της πλάκας και του κόλου κατάστρεψε την μεσαία τάξη και έλεγε με καμάρι ουστ από εδώ αριστεροί με δεξιές τσέπες θιασώτες τού ΝΑΤΟ καί θαυμαστής του τραμπ κοιτάξει κάτι προοδευτικούς πέρα και το ανθρωποειδές τον κατρουγκαλου καί άντε στο διάολο κατακάθι της πολιτικής.	OFF
8619	@USER δινουν μερικοι μαλακες 30 ευρω για τον μηνα,για να περνανε αλλοι εξυπνοι απο πισω σου. γαματο!	OFF
9682	Θα εχουν έρθει τα Χριστούγεννα και ακόμα στην ίδια θα είναι #TheVoiceGR	NOT
7268	Speechless το λένε στην Αγγλία. Στην Ελλάδα το λένε Έβγαλα τον Σκασμό #GNTMgr	NOT
9023	Αλλά η λενιω πολύ σωστά τα είπε στον λαμπρο δεν ήταν καλή για γυναίκα του και είναι καλή για ερωμένη του μη χεσω #AgriesMelisses	NOT
2542	@USER Σίγουρα και δυστυχώς επίσης σίγουρα έχεις δίκιο: κέρδισαν οι μαλάκες	OFF
9724	@USER Ποινικά κολάσιμο είναι πως υπάρχουν μαλάκες που ψήφισαν τον κ. #Γιαννουλη.	OFF
5130	#gntmgr Σουζανα, 50 κιλά κρέας.	OFF
3119	@USER Καποιος πληρωνει τις συνεπειες επειδη δεν εχει αλλη επιλογη! Αν δεν καταλαβαινεις τ λογια τ αλλου δεν δικαιουσαι επιθεσεις. Να μελετησεις να τ καταλαβεις και να διδαξεις κιολας. Και ο καθενας λεει την αποψη τ δημοσια απο αφελεια. Δεν εχει υποψη του οτι υπαρχουν μαλακες.	OFF
5054	Δεν ξέρω για σας αλλά εγώ λατρεύω τον Τάσο (το χορογράφο) ! #gntmgr	NOT
7055	Άι μωρή. Θίχτηκε τώρα η Λενιω λες και δε ξέρουμε τι θα γίνει... ορμα ξάδερφε @USER #AgriesMelisses	NOT
9086	ΜΟΥΥ ΛΕΙΠΕΙΙΣ ΛΥΠΑΜΑΙΑΙΑΙ ΓΙΑΑΤΙ ΣΤΑΑ ΔΥΥΣΚΟΛΑ ΔΕΝ ΗΣΟΥΝ ΕΔΩΩΩ ΓΕΙΑ ΣΟΥ ΜΩΡΗ ΜΑΡΣΩ ΤΡΑΓΟΥΔΑ	NOT
4539	@USER Για να αποκαλύπτει στον λαό τι συζητιέται εκεί μέσα και να πρωτοστατεί στην πάλη εναντίων τους. Μήπως αν είσαι κατά της ΕΕ εξαιρείσαι από αυτά που αποφασίζουν για σένα;	NOT
9367	Αν δεν βαλεις την σελα στην Μαρτινα σε ποιον θα την βαλεις; #gntmgr	NOT
5910	Η Ελευθερία Μπλαζέ κεμπλαζέ, χαρούμενη ή λυπημένη στο τέλος πάντα σας κατουράει #gntmgr	NOT
8931	Η Ασημίνα έχει περασει επεισόδιο που να μην έχει γλύψει έναν τουλάχιστον απ' τους κριτές; Δε θα σε πάρουν για καμαριέρα κούκλα μου χαλαρωσε #GNTMgr	OFF
8340	εγω αγαπω τη μαρια μονο αυτο με νοιαζει #gntmgr	NOT
3102	@USER ποιους μαλακες; διέρρευσαν και τον δικό μου κωδικο; Gijjs Gijjsson του Gijjs;	OFF
6900	#TheVoiceGr Ε..βέβαια...γι'αυτό πήγε και μια δική μου φίλη φωνάρα..φωναρα λέμε όμως..και δεν γύρισε κανείς.. Γιατί δεν ήταν φίλη της @USER	NOT
7065	Τη συνταγή για το κεκάκι την έχουμε..; #kalomesimeraki	NOT
4542	"""σκληρή αυτοκριτική συριζαϊκού ακαου: """" μα με μαλακες σαν και μένα περιμένατε να κερδίσουμε εκλογές;"""""""	OFF
3996	Μονοφαγού και άπληστη είσαι Μαργκώ παραδέξου το! #tatouaz	NOT
3911	Τι χαλι σκουλαρικι ειν αυτο; #ShoppingStar	NOT
5805	Εκεί στα Γιαννιτσά που είναι φιλάνθρωποι, όπως μας προειδοποιεί ο δικηγόρος τους (για να μην πέσουν μηνύσεις...) μπορούν να μας εξηγήσουν πως έγινε η εγκατάσταση των παππούδων τους το 1924-1925, από τον Πόντο, τον Καύκασο, τη Θράκη και την Ανατολική Ρωμυλία; Αχ αυτή η ιστορία...	NOT
6968	@USER Tι λεει ρε ο μλκας. Δεν ξερανε πως θα εχει προσφυγες, δεν ξερανε πως θα χειμωνιάσει, δεν ξέρανε πως ο Ερντογαν ειναι ο Ερντογάν, πάλι καλά που ξέρανε που ειναι το Μαξίμου και δεν πήγανε ξερω γω να κυβερνήσουνε στην Μαδαγασκάρη #ήμαρτον	OFF
9702	@USER Καλα τεμπελη οτι πεις. Σαλτα γαμησου κοπροσκυλο.	OFF
6619	Όταν το πάθος γίνεται ανάμνηση #erwtasmeta	NOT
8844	Θεωρείται “ανθρωπισμός” να μην ψήνουμε χοιρινό να μην πίνουμε αλκοόλ κοντά σε πρόσφυγες; Δηλαδή, στην Αραβία θα θεωρηθεί “ανθρωπισμός” όταν θα διαμαρτυρηθούμε εμείς που η θρησκευτική αστυνομία μαστιγώνει γυναίκες, επειδή φάνηκε 1cm της επιδερμίδας τους;	NOT
5325	"""@USER Δεν υπάρχουν """"λαθρομετανάστες"""", υπάρχουν παράνομοι μετανάστες (χωρίς χαρτιά) κ πρόσφυγες (αδιάφορο νομικά αν έχουν χαρτιά). Εμείς οι πολλοί μια χαρά ζούμε εδώ όλοι μαζί, για εσάς λυπόμαστε π δεν χωνεύεστε ούτε στον καθρέφτη σας."""	NOT
2339	@USER δεν ξέρω πόσο είσαι αλλά αυτά στην Ελλάδα τα έχει κάνει η νδ επιστήμη χρόνια τώρα. Είπαμε, δικιά σας η χώρα, εμείς που δουλεύουμε θα πάμε στο εξωτερικό να γελάμε, όχι να γυρίσουμε στα 500.	NOT
497	Να ξέρεις κερδίζεις πολύ χρόνο αν είσαι ειλικρινής από την αρχή	NOT
2966	@USER Είσαι η καλύτερη	NOT
1552	Να είσαι με κάποιον που σε αγαπά περισσότερο τις μέρες πού εσύ δεν μπορείς.Καλημέρα	NOT
4123	@USER Οχι, θέλουμε Τσίπρα να μας καψει, να μας πνίξει και να μας εξοντώσει στους φόρους για να το παιζει λαϊκό παιδι στα κότερα και να εχουμε αριστερή κυβέρνηση. Αριστερα = Ξεφτίλες.	OFF
4686	@USER Δυστυχώς όμως υπάρχουν γυναίκες που δηλώνουν φεμινίστριες και το κάνουν.	NOT
3488	@USER Σκώληκα είσαι η προσωποποίηση της ανεκτικότητας, όλοι το υποπτευόμασταν, τώρα βεβαιωθήκαμε.	NOT
4331	Θεσσαλονίκη θα πάτε κοριτσια. Θα αλλάζετε κάθε δύο ωρες. ️Θεσσαλονικη #GynaikaXwrisOnoma	NOT
8672	#gntmgr ΑΓΑΠΗ ΜΟΝΟ -- ΣΤΟ ΒΟΥΡΚΟ ΜΩΡΗ	OFF
4238	Λέει ο @USER ότι έδωσε 13η σύνταξη. Σε συζητήσεις μου με κόσμο συνειδητοποιώ ότι δεν τον εμπιστεύεται κάνεις πια. Σύντροφε ξοφλήσατε. Τα γνωστά κολπάκια εξαγοράς ψήφων δεν πιάνουν πλέον. #ερχεται_ΠΟΥΤΣΑ #Συριζα #syriza_xeftiles	NOT
3891	Τσίπρα, σιγά μην είσαι και ο Λένιν Γράφει ο Λευτέρης Χαραλαμπόπουλος	NOT
10208	#GNTMgr Μπράβο Άννα- Μαρια για την καλύτερη φωτο!	NOT
1098	Πάντως το Γωγουλινι σε είκοσι χρόνια θα είναι χάλια,που κάθεται και βγάζει χολή για τη Λορειν. Μακάρι να της έμοιαζε στον ευχάριστο χαρακτήρα. #shoppingstar	NOT
7157	@USER Εκεί που είσαι με τους φίλους σου και παίζετε forthnite και λέτε μαλακίες για τις γυναίκες χαϊδεύεστε μεταξύ σας ποτέ;	NOT
9454	Δεν μπορώ να ασχοληθώ περισσότερο με τα μαιμουδάκια! Θέλω να πω πόσο υπέροχα τα νούμερα του #kratasmystiko ! Πέτυχε η αλλαγή και φάνηκε κατευθείαν! Και εις ανώτερα! ️ #kalytera	NOT
9375	ΛΕΙΠΕΙΣ! #gntmgr	NOT
3398	Άκου να δεις, με ζάλιζε να πάμε για καφέ, αν έχω δεσμό, κλπ κλπ, και ξαφνικά άλλαξε πλεύση και σφυρίζει αδιάφορα. Νομίζει ότι θα κυνηγήσω τώρα. Δεν πάμε καλά... Ή θες ή δεν θες. Τα υπόλοιπα είναι παλιμπαιδισμοί. Με κουράσατε, άντρες. Ένας λογικός και ισορροπημένος υπάρχει;	NOT
3147	@USER Εν τω μεταξύ,ενώ ο κέρδισμενος ηταν ο @USER κι έγινε κοτζάμ Δημαρχαρας, δηλώσεις κάνει ο Πάμπλο και ο Γιαννάκης κάθετε δίπλα του σαν κουτάβι! Ποσο ΜΑΛΑΚΑΣ είσαι ρε Πειραιωτη; Πόσο; (και όχι μόνο οι Πειραιωτες βεβαια)	OFF
5526	Η Ζεν δεν είναι όνομα και πράγμα πάντως #gntmgr	NOT
2071	Που πας με το μίνι μαρη μπουτου; #shoppingstar	NOT
1730	Αμα χασει η ΝΔ τις εθνικες εκλογες θα ειναι λογο του πολυ φιλου μας Μπογδανου. #ΝΔ_ξεφτιλες #syriza_xeftiles #Μπογδανος	NOT
2304	Η φίλη της Ζένια, η Αλίκη, μου είπαν είναι η Σούλα Γκλαμουρους. Δεν βάζω το χέρι μου στην φωτιά. Έτσι μου ειπαν. #poweroflovegr	NOT
6513	Ρουβα κοψε τα ναρκωτικα οσο ειναι νωρις. Ηδη το χεις καμμενο το χωραφακι, μη χειροτερεψεις... #TheVoiceGR	OFF
6222	Μακρυά ρε Ηλέκτρα είπαμε απ' αυτόν! #erwtasmeta	NOT
9639	ΚΛΑΙΩ με τα γυαλιά της Μελίνας ΑΧΑΧΑ, σα μύγα #XFactorGR	NOT
2368	@USER Δε διαφωνω πως η κάθε περιπτωση είναι διαφορετική. Αλλά στα 12 είσαι παιδί, στα 17 έφηβος κ στα 23 ενήλικας. Αρέσει δεν αρέσει είναι στάδια ανάπτυξης. Όταν δεν αναγνωρίζουμε τα όρια, πάντα θα υπάρχουν συνέπειες.	NOT
1999	"""Καλοθελητές θυμήθηκαν(αμεσως!),ολες τις μαλακίες Βενιζελου!ΣΩΣΤΑ!Δειξτε μου εναν """"Αγιο""""ρε μαλακες!Ανατροπη σε ολα λεμε!Ειστε μεσα;"""	OFF
8122	Μου κρατάει μούτρα επειδή θεωρεί υπερβολικό να της λέω να μην σκεπάζεται όταν κοιμάται γιατί μπορεί να έχει κρύψει κάποιον άλλο κάτω από την κουβέρτα. Ε τι να πεις τώρα, γυναίκες, νευριάζουν χωρίς λόγο.	NOT
1954	Ελληνες σηκωθείτε να πάτε ψηφίσετε γιατί οι λαθρο που ελληνοποιησε ο κατσαπλιας #Τσιπρας θα τον ψηφίσουν με χέρια κ με πόδια! #εκλογες2019 #ερχεται_ΠΟΥΤΣΑ	OFF
35	@USER .... βαγγελα....χτενισου... χάλια είσαι μ'αυτο το μαλλί...	NOT
3771	Η αλήθεια είναι πως είσαι ΠΑΝΗΛΙΘΙΟΣ!	OFF
5447	Παιδιά στο Κερατσίνι στοΛιμανάκι είναι ή μου φαίνεται; εξαιρετικές γυαλιστερές και κυδώνια...να τα λεμε κι αυτα! #gntmgr	NOT
7468	Μη κάνετε κοντινά στη Μαρτίνα, φοβόμαστε...#gntmgr	NOT
3361	Δεν χρειάζεται να κάνεις επίδειξη. Αν είσαι ξεχωριστός, θα σε προσέχουν ακόμα και στη σιωπή, γιατί οι καλές πράξεις δεν κάνουν θόρυβο.	NOT
8985	Χαρά, μάθε τους να φέρονται, ρε! #gntmgr	NOT
3018	@USER Μήπως επειδή είσαι ξάδερφος του;	NOT
4210	Συμπληρώθηκε το καρέ της συμφοράς της #ΝΔ_ξεφτιλες !	NOT
1531	Αυτό το φυντανι που έβαζε σόλο ασσους εγώ γτ το έχασα; #shoppingstar	NOT
739	Ρε παιδιά δεν είναι λίγο βλακεία να είσαι μετανάστης και πατριώτης σε ξένοι χώρα και να φωνάζεις έξω οι ξένοι από την χώρα σου;	NOT
1179	@USER Όταν δεν έχεις επιχείρημα υπάρχει το ‘είσαι φασίστας ‘ έλεγαν παλιά οι καθοδηγητές στο ΚΚΕ ...ξέρεις εσυ	NOT
646	Κ τώρα βέβαια δεν θα τα πάρει ο Μήτσος κ ούτε θα διεκδικήσει το γιο του. Γιατί λογικά αυτό θα έκανε ο καθένας! #fail #gynaikaxwrisonoma	NOT
5866	Έχουμε LIVE εικόνα από σύνταγμα #gntmgr	NOT
5783	Άντρες.. Να βγάλετε και πανό ρε	NOT
8367	Η σεξουαλικοποίηση της Αισθητικής του Λιαγκα εκδημοκρατίζει τήν ασέλγεια, γιά να παραμείνει αδιαβάθμητα διασκεδαστική, όπως απαιτεί ο κατευναστικός δογματισμός. της τηλεοπτικότητας. Στήν παρακμή κάθε ευπρέπειας νά γελάμε. Αποκτηνωμένα,αναίσθητα. Αισχρά.	NOT
5628	-Έλεγα να σας ρωτήσω κάτι αλλά ξέρω ότι θα με γράψετε κανονικά! -Λέγε ρε βλήμα τι θες να μάθεις.... -Τι χρώμα και τι είδοςπαντόφλες φοράτε; -Ποιο μαλάκας πεθαίνεις φίλε! -Εχω αυτογνωσία	OFF
7877	#TheVoiceGR αν δεν περασει την βλέπω για μάστερ σεφ	NOT
2820	@USER Έχεις σαν ραγιάς που είσαι το ακαταλόγιστο. ....	NOT
7534	Μόνιμα πίσω από την πλάτη εν τω μεταξύ. #GNTMgr	NOT
3599	Άντε πουτάνες.	OFF
2758	Οτι είναι απαραίτητο να μάθει ότι η Λέσβος και η Μυτιλήνη είναι το ίδιο νησί.Είσαι λίγος κύριε Τσίπρα.Ακόμη και τώρα ξεχάσετε το συγγνώμη .	NOT
5089	Η Σουζάνα είναι το ζωντανό παράδειγμα, γροθιά στο στομάχι του κάθε ρατσιστή , που αποδεικνύει ότι και άνθρωποι άλλου χρώματος μπορεί να είναι σκατάνθρωποι σαν και εμάς #gntmgr	OFF
10086	@USER Να φύγουν. Αυτοί δεν είναι πρόσφυγες.	OFF
4646	@USER Σε επικοινωνια με τονι σιμο βασιλικο ειπε πρωτα ο σκατονι δαλακα εισαι κα@USER και ο χικμετ το επανελαβα κΙ γελουσανε	OFF
3145	@USER Κοίτα γενικά κοντός δεν είμαι αλλά μου αρέσει να με παίρνουν γυναίκες με στραπόν. Αν ξυρίσω τον κώλο μου και έρθω στο Αγρίνιο έχω καμιά ελπίδα; φοράω παπούτσι νο43 #διακριτικοτητα #εχεμυθια #συναινεση	OFF
881	Το κοστούμι που πήρε δεν κοίταξε νούμερο #ShoppingStar	NOT
5969	αχου γελασανε, περασανε υπεροχα, παρολο που δεν ειναι 5χρονα...αυτο τι μας λεει; #gntmgr	NOT
9799	@USER Κι εμεις ειμαστε υπευθυνοι. Μπροστα στα ματια μου εβριζαν ομαδα προσφυγων και δεν ειπα τιποτα. Και ειδα οτι κι αλλοι θελαν να αντιδρασουν και δεν ειπαν τιποτα. Μια μεγαλη γυναικα μονο ειπε αφηστε τους βρε κριμα ειναι. Ενιωσα πολυ ασχημα	NOT
348	@USER Να είσαι σίγουρη	NOT
1328	@USER Είσαι αναρχοβιόλης!	OFF
930	Τι φοράει Χριστέ μου; #giatinparea	NOT
179	Η Ρια παει για διεθνή καριέρα #GynaikaXwrisOnoma	NOT
6051	Γεια σου ρε Μαρια με τις ΑΤΑΚΑΡΕΣ σου ! #GNTMgr	NOT
613	Τι επαγγέλεται η χαμενη ξανθιά αδερφή της Πάολας;#shoppingstar	NOT
8614	Ο Μπαλτακος ήταν γενικός γραμματέας του Σαμαρά.Παραιτηθηκε γιατί τα έλεγε με Κασιδιάρη. Βέβαια με τον Σαμαρά ήταν κολλητοί από το '90 αλλά ο Σαμαράς δεν είχε πάρει χαμπάρι ότι ήταν ναζιδι. Αυτοί και πολλοί άλλοι τέτοιοι απαρτίζουν την σημερινή κυβέρνηση Μητσοτάκη. #ΝΔ_θελατε	NOT
4125	FYR Macedonia θα βλέπαμε, σφουγγοτσιπράριε προπαγανδιστή του ελέους. Και δεν είναι τ´ότι δεν συλλαμβάνεις τη διαφορά και γιατί ήταν χίλιες φορές προτιμότερο αυτό το υπό αίρεση όνομα, αλλά τ´ότι είσαι επαγγελματίας ψεύτης, πλυντήριο προδοτών της εντολής του λαού, που αναγουλιάζει.	OFF
5320	#TheVoiceGR εντωμεταξύ η κόκκινη πλαστική παντελόνα της μαμάς, είναι ό,τι περίσσεψε από τις καρέκλες των κριτών	NOT
3180	"""Τα αγόρια έχουν πάθει ταρακουλο με τον καινούργιο παιδαρα και οχι με την αποχώρηση του Παυλου. Ο Τζονι μεχρι και στο έπιπλο ανέβηκε για να δειξει ποσο """"χαλαρός"""" ειναι #poweroflovegr"""	NOT
6258	Αλογομουρα η μία. Υδροκεφαλη η άλλη. Τις φοβούνται λέει. Μόνο η Κάτια έχει εμφάνιση για να μιλάει ρε άσχημες. Μοντελα μαι αςς #gntmgr	OFF
5397	Η Ασημινα ειναι αυτην η φιλη απο την μουναρα τσιρλιντερ στις αμερικανικες κωμωδιες που ο ρολος της ειναι να εκθειαζει την πρωταγωνιστρια #GNTMgr	OFF
9612	Πάλι καλά που έφυγε η Μαρτίνα σε αυτή τη φάση. Την φαντάζομαι να χτυπιέται και να οδύρεται σαν θαλάσσιο λιοντάρι στα δίχτυα και τρομάζω #GNTMgr	NOT
2158	@USER Άσχημα είναι να είσαι κυματοθραύστης;	NOT
5019	Περούκες χορηγία Jumbo; #GNTMgr	NOT
8579	@USER Μύκονο λέω να πας το αγόρι, μετά το #GNTMgr ομως	NOT
6598	#GNTMgr Το χειρότερο με τις ff είναι : 1. ότι κάνουν μπούλινκ,... 2. δεν το καταλαβαίνουν, διότι 3. το θεωρούν φυσιολογικό.. Είναι απλά ΤΡΑΓΙΚΕΣ!	NOT
