id	tweet	subtask_a
8049	@USER Κρεσέντο εκτός από υποκριτικής και σεξαπίλ, δεν ξέρεις αν πρέπει να τον δείρεις ή να τον #μπιπ... #erwtasmeta #iliasdoukas	NOT
3271	@USER #ερχεται_ΠΟΥΤΣΑ #ερχεται_ΚΑΡΑΠΟΥΤΣΑΚΛΑΡΑ τρολακι του #πρεζεμπορας #sport24	OFF
6763	Η πολιτική της #κυβερνηση_Μητσοτακη έχει ήδη αποτύχει χωρίς δυστυχώς με προοπτική αλλαγής της. Στρατηγέ #Φραγκο ήρθε νομίζω η ώρα να αναλάβεις πρωτοβουλία ένωσης του πατριωτικού χώρου αλλά και όλων των Ελλήνων.#ΝΔ_θελατε #ΝΔ_no_borders #μεταναστευτικο #Μητσοτακης #Τσιπρας #ΝΔ	NOT
7600	@USER Στα ποτά και στις πουτανες.	OFF
1467	"""@USER Ίσως δεν έχει τύχει να δεις αντίστοιχο σχόλιο για τον Ορέστη όπως λες. Συμφωνώ μόνο στην λανθασμένη κατάχρηση του όρου στις γυναίκες. Ο χαρακτηρισμός κάποιας γυναίκας ως """"τσούλας"""", δεν συνεπάγεται τη στέρηση του δικαιώματός της να διαθέτει το σώμα της σε όποιον και όποτε θέλει."""	OFF
8473	Μπράβο στον Φώτη Σεργουλόπουλο, πολλά συγχαρητήρια που αψήφησε τον κίνδυνο λόγω του ότι ήταν διαφορετικός... πολύ συγκινητική συνέντευξη #kalytera #mesanyxta	NOT
5051	Πόσα πλάνα πια αυτοί οι κωλοι; Δεν ξέρουν ότι η πλειονότητα του κοινού τους είναι γυναίκες και gay άνδρες; #GNTMgr	OFF
10099	Ε αι σιχτίρ πια, κερδίστε και καμία μονομαχία	NOT
8858	ΓΙΑΤΙ ΔΕΝ ΣΕ ΦΟΒΑΤΑΙ ΜΑΛΛΟΝ ΡΕ ΖΩΟΝ ΓΑΜΗΜΕΝΗ ΣΠΟΝΤΑ #GNTMgr	OFF
6079	@USER όχι λικέρ ρε, είμαστε άντρες και φοράμε παντελόνια, έλεος κάπου	NOT
422	Θετικό κλίμα και στους εμπρησμούς. Οι φλόγες θα παραμείνουν μακριά από τα δάση, φέτος το καλοκαίρι, χάρη στην επικείμενη νίκη της #ΝΔ_ξεφτιλες	NOT
7488	@USER Δεν μαθαίνει ο Έλληνας Μόνο παθαίνει Νομίζω όμως ότι ο κόμπος έφτασε στο χτένι Εσείς οι γυναίκες πρέπει να μπείτε μπροστά Αυτό που συμβαίνει θα ψαλιδιζει σιγά σιγά τα δικαιώματα σας Οι υπόλοιποι αρωγοί	NOT
1208	ειμαι σε διλλημα ποιος με εχει απαγοητευεσει πιο πολυ. τον τερζο που τον ειχα για σοβαρο και ωριμο ανδρα και κατεληξε παιχνδιακι της ρενιας; ή την κατερινα που την ειχαν πανω απ'ολους και κατεληξε να ερωτευτει τον τον μπιλ ποιος σας εχει απαγοητευσει εσας; #poweroflovegr	NOT
4753	Καν’τα όλα λαμπόγυαλο ρε Γιωργάρα, τόσο καιρό σε δούλευε ψιλό γαζί #GynaikaXwrisOnoma	NOT
949	Μπορεί να θέλει να δώσει όγκο βρε Εμετουλινι, τι σε κόφτει; #shoppingstar	NOT
8754	εν τω μεταξυ #τσουρεκια και με τους τυπους που μαλλιοτραβιουνται με τις γυναικες τους -και το αντιθετο- και παιρνουν τα παιδια και εξαφανίζονται ή πανε στη χωρα τους και κοψοχολιαζομαστε εμεις στα silver alert	NOT
4787	Σιγά Σουζανα θα σου κοπεί η περίοδος. #GNTMgr	OFF
6215	Το #gntmgr #gntm σήμερα	NOT
5666	Κακο σκυλί ψόφο δεν έχει #AgriesMelisses #TheVoiceGR	NOT
4401	@USER Και που είσαι γράφει και για σεβασμό στο Σπανούλη μέσα η δήλωση του! Και λες εσυ σε εμένα για τσοπανους!	OFF
0	Κατι Αριστερες Π@USER που μας πουλαγαν Φεμινισμο της Πλακας δεν βλεπω να μιλανε για την Αλλαγη του Ποινικου Κωδικα θα ναι μαλλον μπουκωμενες απο καναν πρεσβη εκ Βενεζουελας παλι. #ΣΥΡΙΖΑ_ξεφτιλες	OFF
4976	ΣΟΥΖΑΝΑ ΘΑ ΧΑΡΑΜΙΣΩ ΤΗΝ ΑΓΑΠΗΜΕΝΗ ΜΟΥ ΑΤΑΚΑ ΑΛΛΑ ΕΛΑ THANK U, NEXT. #gntmgr	NOT
4004	@USER ΠΈΤΡΟ ΕΊΣΑΙ ΚΑΛΆ;	NOT
5355	Η οικογένεια ειναι ιερή και τα μέλη της αγαπάνε με αγνη αγάπη συζητανε και ξεπερνάνε απο κοινού τα προβλήματα και κανουν τη γυναικα τουσ να αισθανεται ασφαλη κ την προστατευουν κ αμφιδρομα.	NOT
4776	Θα ξαναπαιξουν τον τελικο μπας και κερδισει η γλιτσα το βραδυ; #masterchefgr #shoppingstar	NOT
3577	"""η σεντα σεβαστηκε τον τραυματισμο της σουντε και δεν την επελεξε. η αφροδιτη που την διαλεξε βρηκε τον μπελα της απο τις """"κυριες"""" για να ειναι ενταξει η ασπρη ομαδα επρεπε να μην παιξει καμια και να αποχωρησουν. σημερα οι κυριες μας διδασκουν και δικαιοσυνη #survivorGR"""	NOT
1905	#shoppingstar πρέπει να ρίχνουν κληρο για τις ηλικίες δε γίνεται	NOT
7578	@USER Σόρυ αλλα θα σε πώ κ γώ μαλακισμένο γιατί τους λές πως είναι μαλακισμένα. Τα κορίτσια αυτά ήταν υπέροχα. Πολύ καλύτερα από τους τράγους,τα λαμόγια, τους ηλιθίους κ κάθε είδους άλλο μεσαιωνικό μαλάκα που καθόταν σούζα στην αποθέωση του κίτς με θύματα ανήλικους.	OFF
3194	@USER Άλλη μια ρουφοκαβλέτα συριζαίων #ΣΥΡΙΖΑ_ξεφτιλες τι κάνετε για ένα επιδοματάκι	OFF
2396	#shoppingstar ήρθα μετά από καιρό και δεν βλέπω καθόλου την φίλη μου την @USER!	NOT
5083	Αγαπητή Κάτια κάτι δεν σου κολλάει με τη χαρά αφου όταν βλέπεις την καλοσύνη δεν ξέρεις να την αναγνωρίσεις γιατί δεν την είχες ποτέ #GNTMgr	NOT
4641	@USER Lila χρόνια σου πολλά.Να είσαι πάντα γερη ευτυχισμένη και μαχητική για τα πιστεύω σου, έστω κι αν δεν συμφωνούμε.Ειναι στο κάτω κάτω και η διαφωνία ένας τρόπος για να επικοινωνούμε.	NOT
3071	#shoppingstar εγώ όπως την κόβω τη Γωγώ γύρισε για να πάρει την πρωτιά,δεν την κόβω να δέχτηκε τη συμμετοχή για να βγει πάλι δεύτερη,μελέτησε κ την Καγιά,έβγαλε κ τις τρεσες, βλεφαρίδες, στρας κλπ και πάει για 1000ρικο	NOT
3671	"""Θα κανω σωματείο με επωνυμία """"ΑΝΤΡΙΚΕΣ ΕΡΓΑΣΙΕΣ"""" και καταστατικό σκοπό να εκτελούνται οι εργασίες στο σπίτι απ τους αντρες ενδεδυμένους μονο με μποξεράκια και μια ποδιά. Εξ αλλου, ειναι πιο ικανοί σε ολα, οχι;"""	NOT
6077	Ρε τσαουσόπουλε σε έχω ικανό να πεις Εγώ είπα σ'αυτά τα 4 παδιά να φτιάξουν γκρουπ και να το πουν BEATLES......... #xfactorgr	NOT
7774	Περίμενε Μαρτινα γιατι δεν σας τα ειπαν καλα #gntmgr	NOT
5198	ωραία ρούχα πάντως, να τα λέμε και αυτά #gntmgr	NOT
3482	@USER Φάε το σανό σου λεβέντη μου! Άσε τα υπόλοιπα! Είσαι εσύ περήφανος;	NOT
3926	Πέρασαν σχεδόν 6 μήνες, φίλε μου κι όμως, δεν νιώθω μόνη μου ούτε στιγμή, σαν να είσαι εδώ και να με αγκαλιάζεις. Πάντα θα σε αγαπάω και θα μου λείπεις. Είθε να αναπαύεσαι γαλήνια. Είσαι, πλέον, αιώνιος.️	NOT
8803	Με εξέπληξε ο τυπος! Μπράβο ρε μάγκα! #TheVoiceGR	NOT
2470	@USER Άμα είναι ζηλιάρα η άλλη, όλες οι γυναίκες γύρω της είναι υποψήφιες γκόμενες του άντρα/φίλου/γκομενού τους! Όλοι το ξέρουν αυτό!	NOT
1284	"""#ekloges19 η πρωτη φορα αριστερα εφερε πρωτη φορα αλλοδαπα στο νομο ροδοπης, """"μπραβο"""" ελληνες που ειχατε βγαλει τον αλεκση το 2015, παλι καλα αλλαξανε τα μυαλια το 2019 #ekloges2019 #survivorGR #ηρθε_και_ηταν_μεγαλη #giatinparea #ηρθε #syriza_xeftiles"""	NOT
3631	@USER Είσαι τελείως βλάκας.	OFF
8190	@USER Ο Τσίπρας έχει ένα μεγάλο καημό. Δεν είναι η Χρύση Αυγή στη Βουλή. Αυτό που θέλει να κάνει με το παραλήρημα του είναι να στείλει ψηφαλάκια στην άκρα δεξιά του Βελόπουλου. Από τους μετανάστες το 95% θέλουν να φύγουν. Όσο για τους πρόσφυγες είναι πολλοί λίγοι.	NOT
7234	#gntmgr μην σου τύχει	NOT
1619	Που ειναι το ηθικο σας πλεονεκτημα. Μιλήστε μας γι αυτό.. δεν είμαστε ολοι φασίστες, ακούμε... #ΣΥΡΙΖΑ_ξεφτιλες	NOT
3550	@USER Άρα είσαι ΠΑΟΥΓΚ ΣΥΡΙΖΑΙΑ ΝΑ ΠΟΥΜΕ.	NOT
2529	@USER Πόσο κάφρος είσαι; Για τη φωτιά στο Μαντούδι λέει ο ψεκασμενος που έγινε σε δασική έκταση μακριά από οικισμούς και κατασβέστηκε αμέσως! Υπήρξε ένας απανθρακωμένος που ακόμα δε τον έχει αναζητήσει κανείς! Προφανώς αλλοδαπός εμπρηστής! Και το συγκρίνεις με το Μάτι ρε ξεφτιλισμένε;	NOT
1383	"""""""Δεν είναι μαγκιά να μην ψηφίζεις να τους βάζεις όλους στο ίδιο καζάνι.Ναι,σε σένα μιλάω,που είσαι από 17 έως 21"""" Άρθρο μου @USER για τη σημασία του να πάνε οι νέοι να ψηφίσουν #Ευρωεκλογές #ΣΥΡΙΖΑ #ΜεΤονΣΥΡΙΖΑ #ΑυτήΤηΦοράΨηφίζω #Ευρωεκλογές2019"""	NOT
8214	Μια ευφυής υποτακτική αναγνωρίζει την ομορφιά του χορού στο περιθώριο. Είναι μια ισχυρή,ανεξάρτητη, ταλαντούχα,ικανή γυναίκα από μόνη της, αλλά λαχταρά για έναν Κυρίαρχο να της γαμησει το μυαλό της πολύ πριν αγγίξει το σώμα της. Θέλει έναν άντρα που να αναγνωρίζει την ιση ~Μ.Ο~	OFF
9493	Μην ανησυχείς κοπελαρα μου.. του χρόνου το καλοκαίρι ΟΛΕΣ ΣΤΗ ΜΥΚΟΝΟ ΘΑ ΕΙΣΤΕ..! #GNTMgr	NOT
8918	@USER να το σβήσω τώρα ; και μάλιστα γυναίκα είμαι	NOT
1751	@USER σε αντιθεση με εσένα που είσαι το ψέμα και η προδοσία τις νεότερης ιστορίας....	OFF
9741	Η Κεισι δεν εχει το ουμφ καταλαβετε το. #gntmgr	NOT
7384	@USER Γιατί ρε φιλεύσπλαχνε δεν παίρνεις μερικούς στο σπίτι σου; δίπλα στη γυναίκα σου, στην αδελφή σου να τους ενσωματώσεις.	NOT
1324	Από το 2009 άνοιξες το στόμα σου το 2015 κ έφαγες 22% διαφορά Από το 2015 το ξανανοίξες το 2019 Είσαι γουρλης Κωτσο	NOT
9809	"""Ο οδηγός του λεωφορείου σταμάτησε στο φανάρι,άνοιξε το παράθυρο και άρχισε να βρίζει τον απέναντι οδηγό και είπε """"ΜΕ ΤΗΝ ΓΥΝΑΙΚΑ ΜΟΥ ΡΕ ΘΑ ΣΕ ΓΑΜΗΣΩ"""" και μας κατέβασε όλους λέγοντας """"Αυτό το λεωφορείο θα πάει Κυψέλη κάποια στιγμή Ομόνοιες κλπ ξεχάστε το τώρα στρίβω Ιερά Οδό"""" ΟΚ"""	OFF
5935	Σε αυτό το σημείο να θυμηθούμε ότι η Κατυα είχε συναντήσει ΤΥΧΑΙΑ τον Σκουλο σε μια φωτογράφηση και της είπε, έχουμε καστινγκ #gntmgr την άλλη βδομάδα περνά αν σε βγάλει ο δρόμος.	NOT
2103	@USER Ότι Εσύ είσαι μπεμπεκα δλδ	NOT
9503	Ο διπλός φόβος της κυβέρνησης για το προσφυγικό κι οι ροές δεν θα μειωθούν και οι ευρωπαϊκές χώρες δεν θα γεμίσουν με πρόσφυγες. Όσο για τους ναζί της νδ, σύντομα θα αντιμετωπίσουν αμφιβολίες για την διάθεση ευρωπαϊκών κονδυλίων	NOT
873	ο τερζο κανει ζηλειες στο τζονυ που δεν τον ανεφερε ως φιλο ο παυλοςς δεν σφαζονται μονο οι γυναικες για παρτη του αλλα και οι αντρεςς #poweroflovegr	NOT
3759	Ξερεις τι ωραια θα δειχνει η μουτζουρα στο ποδι σου οταν κρεμάσουν οι πετσες; #shoppingstar	NOT
5742	Μια γυναίκα που δεν νιωθει χαζη..μπορει να γίνει η εκδικητική η αόρατη..το.πρωτο ειναι μικροπρεπεια..το δευτερο αξιοπρεπεια...καληνυχτα μας	NOT
5126	Θα παει η πεφικιτιδα συννεφο που βαζουν απο το ιδιο βουρτσακι της μάσκαρα #gntmgr	NOT
4118	@USER το καλυτερο γλειφομούνι όμως το κάνουν γυναίκες κανέκο και θηλάζουν καλυτερα.	OFF
6891	Η χρόνια δεν τελείωσε, αλλά το αρχιδι της χρονιάς ξέρουμε ήδη ξεκάθαρα ποιος είναι.	OFF
3871	Απορώ γιατί η Μαρίνα δεν έχει πει όλη την αλήθεια στη Μελίτη και δεν έχουν κανονίσει ήδη να φύγουν παρέα. Άλλη μια σεναριακή τρύπα #GynaikaXwrisOnoma	NOT
9429	Η Σπυρουλα είπαμε είναι λάιτ πλας σάιζ; Πού ρε άνθρωποι, τυφλοί ειστε; #gntmgr	NOT
4728	@USER Κι εγώ θα το ήθελα όσο δεν φαντάζεστε,αλλά θεωρητικά η δικαιοσύνη είναι ανεξάρτητη.	NOT
5045	#gntmgr έλα ρε Μαρτινα κανε μας την χάρη .... ! Κ υπόσχομαι για ένα ολόκληρο επεισόδιο να μην γράψω αρνητικό σχόλιο !	NOT
2344	Τρέιλεp #MasterChefGR ,μετά το φαγητό...άμα βλέπεις την πατσαβούρα,δεν το γλιτώνεις το ξερατο..#giatinparea #ShoppingStar #poweroflovegr	OFF
7923	Ηρωική στιγμή η αποχώρηση της Σουζάνας.... Μου θύμισε στιγμές αποχώρησης Μεγκι #GNTMgr	NOT
9778	Σουζανα τι επιθετικοτητα ειναι αυτη ... το κανεις το μπουλιγκ απλα δεν το αντιλαμβανεσαι! #gntmgr	NOT
8366	Ο Νίκος με το μπαλέτο του. #kalomesimeraki	NOT
2031	@USER ΑΠΩΡΟ πώς υποτιμάς έτσι την ομορφιασού.......Δεν είσαι κούκλα...ΚΟΥΚΛΑΡΑ ΕΙΣΑΙ.!	NOT
10097	Ποσό γλοιώδης εισαι ρε Λιάγκα και γενικά όλο το πάνελ εκει . Οτι προσπαθούν να αποδημήσουν τις #AgriesMelisses με απαράδεκτο τροπο και εμμετικά σχόλια με ξεπερνά ! Βούρλα ! #mesimeri_skai	OFF
7501	Τις μισές τις έχουν καταστρέψει τα hair makeovers. Πολυ έμπειροι όσοι αποφάσισαν αυτά τα looks. #gntmgr	NOT
2416	Ποτέ κανείς δεν είναι σίγουρος για τις αποφάσεις του. Επειδή τίποτα δεν πρέπει να κάνουμε πάρα μόνο να γειώνουμε ευλογία. Αν είσαι αναποφάσιστος δεν είναι κακό αλλά λάβε υπόψη σου ότι ποτέ δεν θα είσαι σίγουρος για πολλά εκτός αν είναι η σταγόνα ξεχειλίσματος...	NOT
1342	- Αντε γαμησου ρε μαλακα - Δεν το αντιλήφθην	OFF
2676	@USER Σύντροφε...μας διελυσαν οπως τα ελεγα εγω...η ηττα ειναι βαριά και οπως φαινεται το έριξες στα ναρκωτικά. Κοψτα σύντροφε...μην σου κανεις και αλλο κακό. Έχεις ήδη ένα κουσούρι, εισαι αριστερός...	NOT
4120	το βλημα η βηλμα ειπε για την ζενια οτι ειναι πολυ καλο παιδι κ εχει πολυ καλη ψυχη...οχι αλλες μαλακιες...#poweroflovegr	OFF
4129	@USER Οι άντρες μονο για μπάσκετ κ στοιχημα μιλαμε.	NOT
4220	Πουλο Ψόφο Στοδιαολο Καριόλα Ξεκουμπίδια Γατάκι χαθηκε στο Παγκράτι (το ταημλαην μου τώρα)	OFF
9376	Να φάει το αλάτι που θα ρίχνανε πίσω από την Σουζάνα να της ανέβει η πίεση, αλλά όχι όλο. Δεν ρισκάρουμε #GNTMgr	OFF
8730	Γίνεται κακιά για τα concepts η Κάτια.Δεν είναι τέτοια κατα βάθος.Είναι ολόγλυκια και ευγενέστατη.Δεν καταλάβαμε σωστά,παιδιά. #gntmgr	NOT
8791	,,,Μιχαλολιάκος στην απολογία του,, Με ένα βοσκό και ένα τυροπιτά,, θα έκανα επανάσταση,,	NOT
469	Νιώθω δημοτικός συμβουλιος #shoppingstar	NOT
8975	@USER Καμιά γυναίκα σού στέλνει ή μόνο αλογομουρηδες;	OFF
7289	#GNTMgr εγώ πάντως μέχρι τώρα έχω καταλαβει πως αν δεν μπορείς να κρεμεσαι από κτίρια, να παίζεις με φίδια, να πιάνεις κότες, να πετάς με μπαλόνια, δεν κάνεις για μοντέλο, μάλιστα, μάλιστα...	NOT
2685	@USER Κι εγώ από τον Σταύρο Θεοδωράκη θα θυμάμαι την γελοία υπεκφυγή για το ότι παρά τις προφυλάξεις του πατέρα του, ο μαλάκας τελικά την έσπασε την καπότα.	OFF
2167	"""""""Πολιτικη Γραμματεια"""" Το μονο μηνυμα που δοθηκε, ειναι πως ο λαος ειναι μαλακας. Οποτε αστε τους να πανε να γαμηθουν."""	OFF
1206	@USER Σοβαρά; Μωρέ μπράβο εξέλιξη Ευχαριστώ για την απαντηση κορίτσι μου. Αν είσαι όντως κορίτσι και δεν είσαι μποτ	NOT
10105	Νοστιμη κοπελιτσα η Σοφια. Απο εμφανιση καλα παμε.....ΦΩΝΗ ΝΑ ΕΧΕΙ κ ετοιμη. #thevoicegr	NOT
1138	@USER το ξέρεις ότι είναι φέικ ε; και ότι έπεσε το γέλιο της αρκούδας; καλός μαλάκας είσαι; χαμπάρι δεν έχεις πάρει... εκτός αν είσαι τρολ ξεκωλιάρα, οπότε καλοφάγωτα τα 0,60	OFF
6189	@USER Αν δεν τα παίρνεις απ' το κόμμα, πρέπει να 'σαι πολύ μαλάκας...	OFF
6995	ο μπράτης πάλι περίοδο έχει; #gntmgr	OFF
6001	Στο συμβούλιο του νησιού... Αχ Ντάνο θα τρελαθω Ντάνο #gntmgr	NOT
7495	@USER απο κατι το τοσο απλο για το τσιγαρο λεω, καταλαβαινεις το ποσο πουτανα ειναι ολα στο μυαλο τους, μετα απορουμε γιατι τον πινουμε 40 χρονια	OFF
2247	Ρε @USER εισαι ενα σιχαμενο υποκειμενο. Ενας υπανθρωπος. Προκαλεις εμετο δν ξερεις να κανεις διαλογο εισαι ενας πολιτικος ντελαλης ενας καραγκιοζης κ μισος. Δν ψηφιζω συριζα αλλα πραγματικα το φαινομενο σου πρεπει να εκλειψει. Γυρνα ξαναπουλα βιβλια. #Ekloges2019	OFF
1043	Μαρθα είσαι βλαμμενη τελείως. Θα γυρίσει ο τροχός μωρή. Ανδρέα τώρα τη θυμήθηκες τη ρενα; Δε θελουμε χρυσέ μου. Αν και φοβάμαι θα την κάνει η ρενα μας τη μα@@@@ #GynaikaXwrisOnoma	OFF
1704	@USER Έχει μια λογική βρε αδελφέ . Σου λέει εάν βιάσουν την κόρη τη γυναίκα ή την αδελφή σου και σκοτώσεις το δράστη σε λίγα χρόνια θα είσαι έξω . Για όλα φροντίζουν οι άνθρωποι #ξεφτιλες	NOT
5471	Η μέρα μου σήμερα ιν ε μπριφ Φραπές,μποτέ,μπάμιες,σκύλος,παστίτσιο,συνέδριο,δουλειά,όπεν μπαρ,ζάντα,σκύλος,μανάβικο/24ωρο/ψιλικατζίδικο,μαλάκας πρώην,μοίρασμα παστίτσιου,γενέθλια στο βίντεοκλαμπ,λάντζα	NOT
8262	Τα ρούχα του Μπρατηθ με τόσα τρίγωνα είναι σαν τραπεζομαντιλα σε τραπέζι ιλουμινατι #GNTMgr	NOT
4618	μαλάκα μου οι δεξιοί φαντασιώνονται άσπρες πούτσες να πετάνε. να μου πεις η φράση άσπρες πούτσες να πετάνε συνοψίζει την αντιπολιτευτική γραμμή της ΝΔ αυτά τα χρόνια #ερχεται #ερχεται_ΠΟΥΤΣΑ #όλα_λάθος	OFF
9574	Η ποιότητα των ρούχων του Μπρατη μου θυμίζει φοδρα #GNTMgr	NOT
7321	Τι βλέπει η Καγιά που δεν το βλέπουμε εμεις κ μας επρηξε...#gntmgr	NOT
4606	@USER εισαι τρελος ετσι; δεν,εξηγείτε διαφορετικά	NOT
8546	"""Αυτό το έργο έχει μια αγωνία τι θα ξετρυπώσουμε από το παρελθόν,τι από το παρόν,πως θα """"κολλήσουν"""" όλες οι ιστορίες στο τέλος...Κρατά αμείωτο το ενδιαφέρον,τι να λέμε τώρα! #erwtasmeta"""	NOT
7986	Και οπως ειπε η Ελενα, το χαλασε στο τελος με το... ''βγηκε;'' Νιαου #GNTMgr	NOT
887	Δε θα πει κάτι για Ευρυπιωτη και Ζαρλα; #giatinparea	NOT
9405	Όλοι γνωρίζονται κει μέσα Άντε παω να πέσω #TheVoiceGR	NOT
6577	Αν πας έξω από το εθνικό κέντρο αποκατάστασης αναπήρων που είναι μέσα όλοι αυτοί που σε μια μέρα άλλαξε η ζωή τους από ένα τροχαίο και οργανώσεις βραδιά χώρου, το πρόβλημα είναι αν θα είναι τανγκό, μιλόνγκα ή τσάρλεστον ή τσάμικο; χαίρεται και καληνύχτα #κυρανακης	NOT
